<?xml version="1.0" encoding="UTF-8"?>
<!DOCTYPE empresa SYSTEM "empleados.dtd">

<empresa>
    <departamento>
        <nombre>Desarrollo</nombre>
        <empleados>
            <empleado>
                <id>001</id>
                <nombre>Juan Pérez</nombre>
                <salario>50000</salario>
            </empleado>
            <empleado>
                <id>002</id>
                <nombre>Maria García</nombre>
                <!-- No se proporciona información sobre el salario -->
            </empleado>
        </empleados>
    </departamento>
    <departamento>
        <nombre>Ventas</nombre>
        <empleados>
            <empleado>
                <id>101</id>
                <nombre>Carlos Rodríguez</nombre>
                <salario>60000</salario>
            </empleado>
            <empleado>
                <id>102</id>
                <nombre>Ana Martínez</nombre>
                <salario>55000</salario>
            </empleado>
        </empleados>
    </departamento>
</empresa>
